<?xml version="1.0"?>
<!DOCTYPE Report
[
<!ELEMENT Report (General ,(Doc|BPT)) >
<!ATTLIST Report ver CDATA #REQUIRED tmZone CDATA #REQUIRED>

<!ELEMENT General ( DocLocation ) >
<!ATTLIST General productName CDATA #REQUIRED productVer CDATA #REQUIRED os CDATA #REQUIRED host CDATA #REQUIRED qcserver CDATA #IMPLIED qcproject CDATA #IMPLIED SolManSolutionId CDATA #IMPLIED SolManProjectId CDATA #IMPLIED SolManTestPlanId CDATA #IMPLIED SolManTestPackageId CDATA #IMPLIED SolManUserInfoData CDATA #IMPLIED  >

<!ELEMENT BPT (DName,Res,DVer?,TSet?,TInst?,NodeArgs,AdditionalInfo*,Doc*) >
<!ATTLIST BPT rID ID #REQUIRED >

<!ELEMENT Doc (DName,ConfName?,Res,DVer?,TSet?,TInst?,RunType?,DT?,AdditionalInfo*,Step*,DIter*,Step*,Action*,Doc*,Summary?,TestMaintenanceSummary*,NodeArgs?) >
<!ATTLIST Doc rID ID #REQUIRED type (Test|BC|BPTWrapperTest|Flow|Group|Action) "Test" productName CDATA #REQUIRED BCIter CDATA #IMPLIED >

<!ELEMENT RunType ( #PCDATA )>
<!ATTLIST RunType fmStep (False|True) "False" batch (False|True) "False" upDesc (False|True) "False" upChk (False|True) "False" upAS (False|True) "False">

<!ELEMENT DName ( #PCDATA ) >

<!ELEMENT ConfName ( #PCDATA ) >

<!ELEMENT Res ( #PCDATA ) >

<!ELEMENT AdditionalInfo (AdditionalDataName,AdditionalDataValue ) >

<!ELEMENT AdditionalDataName ( #PCDATA ) >

<!ELEMENT AdditionalDataValue ( #PCDATA ) >

<!ELEMENT DVer ( #PCDATA ) >

<!ELEMENT TSet ( #PCDATA ) >

<!ELEMENT TInst ( #PCDATA ) >

<!ELEMENT DIter (Step*,Action+,Summary?,NodeArgs)>
<!ATTLIST DIter rID ID #REQUIRED iterID CDATA #REQUIRED>

<!ELEMENT DocLocation ( #PCDATA )>

<!ELEMENT Action (AName,AIter*,(Step|HtmlStep|Action)*, Summary,ActionMaintenanceSummary*, NodeArgs ) >
<!ATTLIST Action rID ID #REQUIRED>

<!ELEMENT AIter ((Step|HtmlStep|Action)*,DataMapping?, Summary?,NodeArgs) >
<!ATTLIST AIter rID ID #REQUIRED iterID CDATA #REQUIRED isCountable (False|True) "False" >

<!ELEMENT AName ( #PCDATA ) >

<!ELEMENT TestMaintenanceSummary (ActionMaintenanceSummary*) >
<!ATTLIST TestMaintenanceSummary ObjectsAdded CDATA #REQUIRED ObjectsUpdated CDATA #REQUIRED StepsUpdated CDATA #REQUIRED StepsComments CDATA #REQUIRED><!ELEMENT ActionMaintenanceSummary (ObjectChange* ) >
<!ATTLIST ActionMaintenanceSummary Action CDATA #REQUIRED Objects CDATA #REQUIRED Updated CDATA #REQUIRED LinesTotal CDATA #REQUIRED Added CDATA #REQUIRED LinesUpdated CDATA #REQUIRED>

<!ELEMENT ObjectChange  (Hierarchy, PropertyChangeList* ) >
<!ATTLIST ObjectChange Operation CDATA #IMPLIED OriginalRepository CDATA #IMPLIED>

<!ELEMENT PropertyChangeList (PropertyDef*) >

<!ELEMENT PropertyDef (OriginalValue, NewValue) >
<!ATTLIST PropertyDef PropName CDATA #REQUIRED OriginRegularExpression (True|False) "False" NewRegularExpression (True|False) "False" AddedProperty (True|False) "False" >

<!ELEMENT OriginalValue ( #PCDATA )>

<!ELEMENT NewValue ( #PCDATA )>

<!ELEMENT Hierarchy  (ObjectName, Hierarchy*) >
<!ATTLIST Hierarchy MicClass CDATA #REQUIRED>

<!ELEMENT ObjectName  ( #PCDATA ) >

<!ELEMENT Step (Obj,Details,Time,TimeTick* ,(Step|HtmlStep|Doc)*, DataMapping?, NodeArgs) >
<!ATTLIST Step rID ID #REQUIRED retval CDATA #IMPLIED>

<!ELEMENT HtmlStep (HTML,TimeTick*,(Step|HtmlStep|Doc)*,NodeArgs) >
<!ATTLIST HtmlStep rID ID #REQUIRED >

<!ELEMENT Obj ( #PCDATA ) >
<!ATTLIST Obj plainTxt (False|True) "True">

<!ELEMENT Details ( #PCDATA ) >
<!ATTLIST Details plainTxt (False|True) "True">

<!ELEMENT Time ( #PCDATA ) >

<!ELEMENT HTML ( #PCDATA ) >

<!ELEMENT Disp ( #PCDATA ) >

<!ELEMENT TimeTick ( #PCDATA ) >

<!ELEMENT DataMapping ( DataMappedItem* )>
<!ELEMENT DataMappedItem EMPTY >
<!ATTLIST DataMappedItem dsName CDATA #REQUIRED >
<!ATTLIST DataMappedItem rowId CDATA #REQUIRED >

<!ELEMENT NodeArgs (Disp,TopPane?,BtmPane?,ExtendedInfo? )>
<!ATTLIST NodeArgs eType CDATA #REQUIRED icon CDATA #REQUIRED nRep CDATA #REQUIRED UserNote CDATA #IMPLIED filter (False|True) "True">
<!ATTLIST NodeArgs status (Passed|Failed|Done|Warning|Information) "Done">
<!ATTLIST NodeArgs iconSel CDATA #IMPLIED nType CDATA #IMPLIED MovieMarker CDATA "">
<!ATTLIST NodeArgs Source CDATA #IMPLIED SourceLine CDATA #IMPLIED StepFlowItemKey CDATA #IMPLIED >

<!ELEMENT TopPane (Path)>

<!ELEMENT BtmPane ( (Path|WR)?,ASHilite?)>
<!ATTLIST BtmPane vType CDATA "HTML">

<!ELEMENT Path ( #PCDATA ) >

<!ELEMENT ASHilite ( #PCDATA ) >

<!ELEMENT WR ( #PCDATA ) >

<!ELEMENT ExtendedInfo ( StepData ) >

<!ATTLIST ExtendedInfo StepType CDATA #REQUIRED>
<!ELEMENT DT (NodeArgs) >
<!ATTLIST DT rID ID #REQUIRED>

<!ELEMENT Summary (Param*)>
<!ATTLIST Summary sTime CDATA #IMPLIED eTime CDATA #IMPLIED passed CDATA #IMPLIED failed CDATA #IMPLIED warnings CDATA #IMPLIED retval CDATA #IMPLIED stopped (False|True) "False" >

<!ELEMENT Param (ParamName,ParamVal)+ >
<!ATTLIST Param paramInOut (In|Out) "In">

<!ELEMENT ParamName ( #PCDATA ) >

<!ELEMENT ParamVal ( #PCDATA ) >

]
>
<Report ver="2.0" tmZone="中国标准时间">
<General productName="HP Unified Functional Testing" productVer="11.50" os="" host="LAPTOP-0JH0O2IK"><DocLocation><![CDATA[C:\Users\lenovo\Documents\Unified Functional Testing\注册]]></DocLocation></General>
<Doc rID="T1"   productName= "HP Unified Functional Testing"  >
<DName><![CDATA[注册]]></DName>
<Res><![CDATA[Res2]]></Res>
<DT rID="T2">
<NodeArgs eType="Table" icon="2" nRep="4" filter="False" >
<Disp><![CDATA[Run-Time Data Table]]></Disp>
<BtmPane vType="Table" >
<Path><![CDATA[Default.xls]]></Path>
</BtmPane>
</NodeArgs>
</DT>
<DIter rID="T3" iterID="1" >
<Action rID="T4">
<AName><![CDATA[Action1]]></AName>
<Step rID="T5">
<Obj plainTxt="False" ><![CDATA[Google Chrome]]></Obj>
<Details plainTxt="False" ><![CDATA[Window]]></Details>
<Time><![CDATA[2021/12/22 - 11:39:35]]></Time>
<TimeTick>1640144375</TimeTick>
<Step rID="T6">
<Obj plainTxt="False" ><![CDATA[Chrome Legacy Window.Click]]></Obj>
<Details plainTxt="False" ><![CDATA[696, 192]]></Details>
<Time><![CDATA[2021/12/22 - 11:39:35]]></Time>
<TimeTick>1640144375</TimeTick>
<NodeArgs eType="Replay" icon="6" nRep="10" Source="Action1" SourceLine="-1" >
<Disp><![CDATA[Chrome Legacy Window.Click]]></Disp>
</NodeArgs>
</Step>
<Step rID="T7">
<Obj plainTxt="False" ><![CDATA[Chrome Legacy Window.Click]]></Obj>
<Details plainTxt="False" ><![CDATA[696, 192]]></Details>
<Time><![CDATA[2021/12/22 - 11:39:35]]></Time>
<TimeTick>1640144375</TimeTick>
<NodeArgs eType="Replay" icon="6" nRep="12" Source="Action1" SourceLine="-1" >
<Disp><![CDATA[Chrome Legacy Window.Click]]></Disp>
</NodeArgs>
</Step>
<Step rID="T8">
<Obj plainTxt="False" ><![CDATA[Chrome Legacy Window.Click]]></Obj>
<Details plainTxt="False" ><![CDATA[694, 257]]></Details>
<Time><![CDATA[2021/12/22 - 11:39:36]]></Time>
<TimeTick>1640144376</TimeTick>
<NodeArgs eType="Replay" icon="6" nRep="14" Source="Action1" SourceLine="-1" >
<Disp><![CDATA[Chrome Legacy Window.Click]]></Disp>
</NodeArgs>
</Step>
<Step rID="T9">
<Obj plainTxt="False" ><![CDATA[Chrome Legacy Window.Click]]></Obj>
<Details plainTxt="False" ><![CDATA[694, 257]]></Details>
<Time><![CDATA[2021/12/22 - 11:39:36]]></Time>
<TimeTick>1640144376</TimeTick>
<NodeArgs eType="Replay" icon="6" nRep="16" status="Warning" Source="Action1" SourceLine="-1" >
<Disp><![CDATA[Chrome Legacy Window.Click]]></Disp>
</NodeArgs>
</Step>
<Step rID="T10">
<Obj plainTxt="False" ><![CDATA[Chrome Legacy Window]]></Obj>
<Details plainTxt="False" ><![CDATA[对象不可见]]></Details>
<Time><![CDATA[2021/12/22 - 11:39:36]]></Time>
<TimeTick>1640144376</TimeTick>
<Step rID="T11">
<Obj plainTxt="False" ><![CDATA[Chrome Legacy Window]]></Obj>
<Details plainTxt="False" ><![CDATA[对象的物理描述:<br>regexpwndclass = Chrome_RenderWidgetHostHWND<br>]]></Details>
<Time><![CDATA[2021/12/22 - 11:39:36]]></Time>
<TimeTick>1640144376</TimeTick>
<NodeArgs eType="Replay" icon="7" nRep="18" status="Warning" nType="描述" Source="Action1" SourceLine="-1" >
<Disp><![CDATA[Chrome Legacy Window]]></Disp>
</NodeArgs>
</Step>
<NodeArgs eType="Replay" icon="6" nRep="17" status="Failed" nType="运行错误" Source="Action1" SourceLine="-1" >
<Disp><![CDATA[Chrome Legacy Window]]></Disp>
</NodeArgs>
</Step>
<NodeArgs eType="Context" icon="5" nRep="9" status="Failed" Source="Action1" SourceLine="-1" >
<Disp><![CDATA[Google Chrome]]></Disp>
</NodeArgs>
</Step>
<Step rID="T12">
<Obj plainTxt="False" ><![CDATA[运行错误]]></Obj>
<Details plainTxt="False" ><![CDATA[对象不可见<BR>第 (3) 行: &quot;Window(&quot;Google Chrome&quot;).WinObject(&quot;Chrome Legacy Window&quot;).Click 694,257&quot;。 ]]></Details>
<Time><![CDATA[2021/12/22 - 11:39:36]]></Time>
<TimeTick>1640144376</TimeTick>
<NodeArgs eType="Replay" icon="7" nRep="19" status="Failed" Source="Action1" SourceLine="2" >
<Disp><![CDATA[运行错误]]></Disp>
</NodeArgs>
</Step>
<Step rID="T13">
<Obj plainTxt="False" ><![CDATA[停止运行]]></Obj>
<Details plainTxt="False" ><![CDATA[用户停止运行。]]></Details>
<Time><![CDATA[2021/12/22 - 11:39:39]]></Time>
<TimeTick>1640144379</TimeTick>
<NodeArgs eType="General" icon="8" nRep="20" >
<Disp><![CDATA[停止运行]]></Disp>
</NodeArgs>
</Step>
<Summary sTime="2021/12/22 - 11:39:35" eTime="2021/12/22 - 11:39:39" passed="0" failed="2" warnings="2" ></Summary>
<NodeArgs eType="StartAction" icon="4" nRep="7" status="Failed" >
<Disp><![CDATA[Action1 概要]]></Disp>
</NodeArgs>
</Action>
<NodeArgs eType="StartIteration" icon="3" nRep="6" status="Failed" >
<Disp><![CDATA[注册 迭代 1 (行 1)]]></Disp>
</NodeArgs>
</DIter>
<Summary sTime="2021/12/22 - 11:39:35" eTime="2021/12/22 - 11:39:39" passed="0" failed="2" warnings="2" ></Summary>
<NodeArgs eType="StartTest" icon="1" nRep="3" status="Failed" >
<Disp><![CDATA[测试 注册 概要]]></Disp>
</NodeArgs>
</Doc>
</Report>